<?xml version="1.0" encoding="UTF-8"?>
<clase modulo="3" nommodul="Programación básica" xmlns:xsi="http://www.w3.org/2001/XMLSchema-instance" xsi:noNamespaceSchemaLocation="file:/D:/Inma_2020-21/1Dam_MARCAS/0-MiTemarioMarcas/EjerciciosMarcasVisualCode/EjerTema2/EjerPunto3-XSD.xsd">
  <curso numero="1" especialidad="ASIR">
    <profesor>
      <nombre> Marcelino </nombre>
      <apellido> Pardo </apellido>
    </profesor>
    <alumnos>
      <alumno>
        <nombre> Filomeno </nombre>
        <apellido> García </apellido>
        <nota> 5 </nota>
      </alumno>
      <alumno delegado="si">
        <nombre> Frederic </nombre>
        <apellido> Paz </apellido>
        <nota> 3 </nota>
      </alumno>
      <alumno>
        <nombre> Manel </nombre>
        <apellido> Parrales </apellido>
        <nota> 8 </nota>
      </alumno>
    </alumnos>
  </curso>
</clase>
